{
  "schema_version": 1,
  "revision": 1,
  "model_catalog_ref": "models_face_qcs6490_v1",
  "max_total_resident_bytes": 536870912,
  "max_model_resident_bytes": 67108864,
  "sources": [
    {
      "source_id": "camera_front",
      "raw_source_ref": "fw_raw_camera_front",
      "camera_id": 0,
      "channel_id": 0,
      "preview_output_ref": "detect0",
      "width": 1920,
      "height": 1080,
      "fps_numerator": 30,
      "fps_denominator": 1,
      "max_frame_allocation_bytes": 4194304,
      "max_inflight_frames": 2,
      "preview_surface_count": 8,
      "max_tensor_bytes": 16777216,
      "max_temporal_bytes": 33554432,
      "model_ids": ["scrfd_500m_bnkps"],
      "cascade": {
        "frames": 2,
        "tasks_per_frame": 8,
        "max_bytes": 16777216
      }
    }
  ]
}
