{
  "schema_version": 1,
  "revision": 1,
  "model_catalog_ref": "models_qcs6490_v1",
  "max_total_resident_bytes": 1073741824,
  "max_model_resident_bytes": 134217728,
  "sources": [
    {
      "source_id": "camera_front",
      "raw_source_ref": "fw_raw_camera_front",
      "camera_id": 0,
      "channel_id": 0,
      "preview_output_ref": "detect0",
      "width": 3840,
      "height": 2160,
      "fps_numerator": 25,
      "fps_denominator": 1,
      "max_frame_allocation_bytes": 16777216,
      "max_inflight_frames": 2,
      "preview_surface_count": 2,
      "max_tensor_bytes": 16777216,
      "max_temporal_bytes": 33554432,
      "model_ids": ["person_detector"],
      "cascade": { "frames": 2, "tasks_per_frame": 8, "max_bytes": 8388608 }
    },
    {
      "source_id": "box_input_1",
      "raw_source_ref": "fw_raw_box_input_1",
      "camera_id": 1,
      "channel_id": 0,
      "preview_output_ref": "",
      "width": 1920,
      "height": 1080,
      "fps_numerator": 25,
      "fps_denominator": 1,
      "max_frame_allocation_bytes": 4194304,
      "max_inflight_frames": 2,
      "preview_surface_count": 0,
      "max_tensor_bytes": 16777216,
      "max_temporal_bytes": 33554432,
      "model_ids": ["person_detector"]
    }
  ]
}
